PlaceID,Review
ChIJYdlP40JO_xMRlrRwaX2v008,"Mediocre Vietnamese.
Pieces of chopped offals too big and chewy."
ChIJWbMZ9rkABDQR19Ul2gHcoPQ,Indian and Vietnam style curry not bad
ChIJtQ5htCL5AzQRh_PX107HDqQ,"Beef Tanghe Super Bowl, I haven't tried it, it's delicious!"
ChIJJdamSKv4AzQRNMglHLUDCxM,Superb tom yum goong soup and chicken wings!
ChIJp7mV2ZcFBDQRbvPm70W4XIE,Authentic vietnamese cuisine. Delicious food and affordable price) highly recommend this restaurant :)
ChIJvZmj_uwDBDQRfLKg9oomBEQ,"Nice small Vietnam Food shop with big portion food, good taste and worth to visit."
ChIJOcS7F90GBDQR3HKYSMfkCiU,Yummy pork chop vermicelli! Yet pan-fried veggie would take long. Overall recommended if you don't mind sitting on the street.
ChIJ9ysiIMcABDQRXVulXrh0fRc,"Delicious Korean food, good variety of choice, great service, chilled vibe. We had a great evening here. Recommended."
ChIJP8-Nn08BBDQRNoMCpzVTO6w,"Good bibimbap ! I appreciated my experience there, it’s a nice Korean restaurant. I recommend it !"
ChIJrVZ-JVEABDQRKhxmLGgrF8U,"Delicious fried chicken! We ordered the crunchy one, the seasoning is on point!
The egg with the cheese is also pretty good. The egg is nice and fluff"
ChIJw-nWC8cABDQRmpFZZnCG5IA,"Good Korean food with fair prices!
But room to improve the service.
If you love koren fried chicken, can try this restaurant!"
"ChIJF52kku4ABDQRIJ-_wEGMLhI
","Second visit in two months time. Tried their fried squid, seafood veg pancake and cheesy pork belly this time. Generous portion and very delicious overall. Must-try Korean restaurant in TST."
ChIJzR5W51AABDQRzhFPohJkqa4,"Tasty cold buckwheat noodles
Garlic and cheese style chicken"
ChIJyeh94VYABDQRFkcFJYY5Cks,Koreans cooking and serving in this restaurant. I would take that as a plus!
ChIJ84aFzYD_AzQRH_IEcdAKy5g,This is the wonderful Koran fusion western food I have ever take. Must go and try other food!
ChIJp54G6cYABDQRrL3O4-2uN50,"Nice place to have Korean BBQ buffet, great service and really worth the price. 141HKD per pax after service charge."
ChIJMcE3E8gABDQRW-GNMc3LepI,Nice place for Korean BBQ.  The quality of meat are good and fresh seafood.
ChIJY7quEe4ABDQREEWfEMTQYko,"Chicken is marinated quite nice, not deep fried, they say it's baked. However over 50% of the menu is chicken. Not much other option. Reasonable price."
ChIJy1O0XcgBBDQRxz2DAsEwOIY,Little cozy korean restaurant with warm ginseng cicken soup!
ChIJBcpPE8gABDQRkSqCWu3DrhM,First time to try bongchu jjimdak in Hong kong. Same taste with Korea bongchu. Good and delicious 
ChIJhRoiyO4ABDQRHNJX0kugMQw,Authentic Korean restaurant. Reasonable priced and lots of varieties in their menu. And their staffs are absolutely friendly and helpful too
ChIJF611zIj5AzQRs8dlGpiU6C8,Great variety of BBQ food. And it's a HK restaurant supporting HK people
ChIJJzDscu4ABDQR6HFLqOO52Mw,"Good seating. Many food choices.
Helpful staff. Good ventilation, not making you smelly after the BBQ.
Like the beef, taste good, rich beef flavour and soft.
One of the restaurants that I shall revisit.
Average around hkd450 - 500 per person"
ChIJL0S8xlYABDQREBr9jGIurBs,"Had a pizza and fried chicken for dinner. They were both well made and very tasty, except that a strong aftertaste lingered in my mouth for hours. It might be the artificial seasonings and msg. Service was good. A pizza, 12 pieces of chicken plus a beer costed over $500"
 ChIJ8zuN-K0BBDQR8_nxosRZtCk,Third time here. Delicious! Highly recommend the Spain Pork.
ChIJy8f-b8YABDQRIgXl9txAcKs,"Huge portion for sharing
Ordered some sides as well, also very delicious
Love the kim chi pizza"
ChIJQ7sb3g0BBDQRgx5W8vFt1Lg,Hong Kong style western restaurant. Local people should love their food. Reasonable price
ChIJQSUDe5sIBDQRFOc2Z7eX7V0,Chinese fast food is acceptable.
